{
  "version": 1,
  "name": "IRAP Protected",
  "description": "IRAP Protected compliance requirements",
  "color": "#FFB800",
  "requirements": [
    {
      "name": "ISM-0402 Application security testing",
      "description": "Applications are comprehensively tested for vulnerabilities, using static application security testing and dynamic application security testing, prior to their initial release and any subsequent releases.",
      "controls": [
        {
          "name": "scanner_sast_running",
          "control_type": "internal",
          "expression": {
            "field": "scanner_sast_running",
            "operator": "=",
            "value": true
          }
        },
        {
          "name": "scanner_dast_running",
          "control_type": "internal",
          "expression": {
            "field": "scanner_dast_running",
            "operator": "=",
            "value": true
          }
        }
      ]
    },
    {
      "name": "ISM-1163 Continuous monitoring plan",
      "description": "Systems have a continuous monitoring plan that includes: conducting vulnerability scans for systems at least fortnightly, conducting vulnerability assessments and penetration tests for systems prior to deployment, including prior to deployment of significant changes, and at least annually thereafter, analysing identified vulnerabilities to determine their potential impact, and implementing mitigations based on risk, effectiveness and cost.",
      "controls": [
        {
          "name": "scanner_dep_scanning_running",
          "control_type": "internal",
          "expression": {
            "field": "scanner_dep_scanning_running",
            "operator": "=",
            "value": true
          }
        },
        {
          "name": "scanner_container_scanning_running",
          "control_type": "internal",
          "expression": {
            "field": "scanner_container_scanning_running",
            "operator": "=",
            "value": true
          }
        },
        {
          "name": "scanner_dast_running",
          "control_type": "internal",
          "expression": {
            "field": "scanner_dast_running",
            "operator": "=",
            "value": true
          }
        },
        {
          "name": "scanner_api_security_running",
          "control_type": "internal",
          "expression": {
            "field": "scanner_api_security_running",
            "operator": "=",
            "value": true
          }
        }
      ]
    },
    {
      "name": "ISM-1422 Development, testing and production environments",
      "description": "Unauthorised access to the authoritative source for software is prevented.",
      "controls": [
        {
          "name": "default_branch_protected",
          "control_type": "internal",
          "expression": {
            "field": "default_branch_protected",
            "operator": "=",
            "value": true
          }
        }
      ]
    },
    {
      "name": "ISM-1698 Scanning for unmitigated vulnerabilities",
      "description": "A vulnerability scanner is used at least daily to identify missing patches or updates for vulnerabilities in online services.",
      "controls": [
        {
          "name": "scanner_dep_scanning_running",
          "control_type": "internal",
          "expression": {
            "field": "scanner_dep_scanning_running",
            "operator": "=",
            "value": true
          }
        },
        {
          "name": "scanner_container_scanning_running",
          "control_type": "internal",
          "expression": {
            "field": "scanner_container_scanning_running",
            "operator": "=",
            "value": true
          }
        }
      ]
    },
    {
      "name": "ISM-1700 Scanning for unmitigated vulnerabilities",
      "description": "A vulnerability scanner is used at least fortnightly to identify missing patches or updates for vulnerabilities in applications other than office productivity suites, web browsers and their extensions, email clients, PDF software, and security products.",
      "controls": [
        {
          "name": "scanner_dep_scanning_running",
          "control_type": "internal",
          "expression": {
            "field": "scanner_dep_scanning_running",
            "operator": "=",
            "value": true
          }
        },
        {
          "name": "scanner_container_scanning_running",
          "control_type": "internal",
          "expression": {
            "field": "scanner_container_scanning_running",
            "operator": "=",
            "value": true
          }
        },
        {
          "name": "scanner_dast_running",
          "control_type": "internal",
          "expression": {
            "field": "scanner_dast_running",
            "operator": "=",
            "value": true
          }
        },
        {
          "name": "scanner_api_security_running",
          "control_type": "internal",
          "expression": {
            "field": "scanner_api_security_running",
            "operator": "=",
            "value": true
          }
        }
      ]
    },
    {
      "name": "ISM-1701 Scanning for unmitigated vulnerabilities",
      "description": "A vulnerability scanner is used at least daily to identify missing patches or updates for vulnerabilities in operating systems of internet-facing servers and internet-facing network devices.",
      "controls": [
        {
          "name": "scanner_container_scanning_running",
          "control_type": "internal",
          "expression": {
            "field": "scanner_container_scanning_running",
            "operator": "=",
            "value": true
          }
        },
        {
          "name": "scanner_dast_running",
          "control_type": "internal",
          "expression": {
            "field": "scanner_dast_running",
            "operator": "=",
            "value": true
          }
        },
        {
          "name": "scanner_api_security_running",
          "control_type": "internal",
          "expression": {
            "field": "scanner_api_security_running",
            "operator": "=",
            "value": true
          }
        }
      ]
    },
    {
      "name": "ISM-1702 Scanning for unmitigated vulnerabilities",
      "description": "A vulnerability scanner is used at least fortnightly to identify missing patches or updates for vulnerabilities in operating systems of workstations, non-internet-facing servers and non-internet-facing network devices.",
      "controls": [
        {
          "name": "scanner_dep_scanning_running",
          "control_type": "internal",
          "expression": {
            "field": "scanner_dep_scanning_running",
            "operator": "=",
            "value": true
          }
        },
        {
          "name": "scanner_container_scanning_running",
          "control_type": "internal",
          "expression": {
            "field": "scanner_container_scanning_running",
            "operator": "=",
            "value": true
          }
        }
      ]
    },
    {
      "name": "ISM-1808 Scanning for unmitigated vulnerabilities",
      "description": "A vulnerability scanner with an up-to-date vulnerability database is used for vulnerability scanning activities.",
      "controls": [
        {
          "name": "scanner_dep_scanning_running",
          "control_type": "internal",
          "expression": {
            "field": "scanner_dep_scanning_running",
            "operator": "=",
            "value": true
          }
        },
        {
          "name": "scanner_container_scanning_running",
          "control_type": "internal",
          "expression": {
            "field": "scanner_container_scanning_running",
            "operator": "=",
            "value": true
          }
        }
      ]
    },
    {
      "name": "ISM-1816 Development, testing and production environments",
      "description": "Unauthorised modification of the authoritative source for software is prevented.",
      "controls": [
        {
          "name": "default_branch_protected",
          "control_type": "internal",
          "expression": {
            "field": "default_branch_protected",
            "operator": "=",
            "value": true
          }
        }
      ]
    },
    {
      "name": "ISM-1875 Protecting credentials",
      "description": "Networks are scanned at least monthly to identify any credentials that are being stored in the clear.",
      "controls": [
        {
          "name": "scanner_secret_detection_running",
          "control_type": "internal",
          "expression": {
            "field": "scanner_secret_detection_running",
            "operator": "=",
            "value": true
          }
        }
      ]
    }
  ]
}
